{
  "artifact": "LFM2.5-1.2B-Instruct_int4.litertlm",
  "device": "raspberry-pi-5",
  "model_id": "lfm2.5-1.2b-instruct-int4",
  "quantization": null,
  "results": [
    {
      "accelerator": "cpu",
      "context_length": null,
      "date": "2026-09-01",
      "decode_tokens_per_s": 9.29,
      "delegated_ops": null,
      "env": {
        "device": "Raspberry Pi 5 Model B Rev 1.1",
        "machine_label": "raspberry-pi-5-cooled-52c",
        "os_build": "Linux-6.18.34+rpt-rpi-2712-aarch64-with-glibc2.41",
        "runtime": "litert-lm",
        "runtime_version": "0.16.1",
        "soc": "Broadcom BCM2712",
        "vendor_sdk": null
      },
      "error": null,
      "evidence": [
        "pi5 LLM sweep row: `litert-lm benchmark --backend cpu --cpu-thread-count 4 -p 256 -d 256 --runs 1 --cache memory` (wave-2 driver pi5_llm_bench.py; --cache memory rather than the house --cache no, which OOM-kills every >=1.2B file on the 8 GB Pi — equivalence measured on granite-350m int8, +2-3%), 3 invocations per file with cool-down to <=52 C between them, vcgencmd measure_temp + get_throttled logged per invocation, peak RSS polled from /proc; throughput = median of the three invocations (spread in metrics); a row counts as measured only when the real-generation gate (`litert-lm run`, degenerate-output check) passed and every invocation exited 0 with get_throttled 0x0",
        "versions: cpu=Raspberry Pi 5 Model B Rev 1.1, litert-lm=0.16.1, litert-lm-api=0.16.1, platform=Linux-6.18.34+rpt-rpi-2712-aarch64-with-glibc2.41, python=3.13.5",
        "cache mode 'memory'; -p 256 -d 256 --runs 1 --cpu-thread-count 4",
        "gate ('What is 17 plus 26? Answer with the number only.'): status pass, exit 0, wall 54.5 s, output head '53'",
        "invocation 0: exit=0 wall_s=92.0 temp 49.9->53.2C throttled=0x0 prefill_tps=54.19 decode_tps=9.34 ttft_s=4.831 init_s=34.2405 peak_rss_mb=1455",
        "invocation 1: exit=0 wall_s=100.1 temp 50.5->53.8C throttled=0x0 prefill_tps=54.09 decode_tps=9.26 ttft_s=4.841 init_s=33.8695 peak_rss_mb=1455",
        "invocation 2: exit=0 wall_s=100.0 temp 51.0->53.8C throttled=0x0 prefill_tps=53.67 decode_tps=9.29 ttft_s=4.8774 init_s=33.81 peak_rss_mb=1454"
      ],
      "failure_class": null,
      "full_delegation": null,
      "latency_p50_ms": null,
      "loads": true,
      "max_abs_diff": null,
      "max_rel_diff": null,
      "metrics": {
        "decode_tokens": 256.0,
        "decode_tps_max": 9.34,
        "decode_tps_min": 9.26,
        "init_s": 33.8695,
        "init_s_max": 34.2405,
        "init_s_min": 33.81,
        "invocations": 3.0,
        "prefill_tokens": 256.0,
        "prefill_tps_max": 54.19,
        "prefill_tps_min": 53.67,
        "runs_per_invocation": 1.0,
        "threads": 4.0,
        "ttft_s_max": 4.8774,
        "ttft_s_min": 4.831
      },
      "output_match": null,
      "peak_mem_mb": 1455.0,
      "prefill_tokens_per_s": 54.09,
      "provenance": "measured",
      "runs": true,
      "total_ops": null,
      "ttft_ms": 4841.0
    }
  ],
  "schema_version": "1.0"
}
