{
  "artifact": "embeddinggemma-2-740m.litertlm",
  "artifact_sha256": "e7a8a2204b91e0f96e92960e84a09a89212e1633dcb7575a9bf3378b4df77f4c",
  "device": "galaxy-s26",
  "model_id": "embeddinggemma-2-740m",
  "notes": "EmbeddingGemma 2 740M (litert-community/embeddinggemma-2-740m-litert-lm, Google's CPU/GPU bundle; sha256 computed on the phone and on the Mac after the push, equal) through LiteRT-LM 0.18.0's EmbeddingEngine in the hfmodels-android sample samples/eg2search (spoken sentence -> vector -> the nearest of the user's photos). The sample calls the runtime directly (not the SDK, which pins 0.16.1). Engine: backend GPU for the text backbone, visionBackend GPU for the photos, audioBackend CPU for the audio encoder (the delegate lines, evidence: the backbone and vision graphs whole on LITERT_CL, the audio encoder on XNNPACK), so full_delegation is written as #181(2) does for an audio-in bundle whose encoder stays on the CPU. latency_p50_ms = the median of three spoken queries' audio -> vector (2.0-2.6 s clips; top-1 = the gold photo on all three, so output_match stays null); the 36 photos' embeddings are photo_embed_*. The device check runs in the instrumentation process; the app on screen read 113.6-139.2 ms for the same clips (top-app), not entered. rerun_* = the supervisor's rerun of 2026-10-10 00:11 (thermal 1 when the hold was taken), slower: 234.2-271.1 ms. The NPU bundle (SM8850) did not initialize with the QAIRT 2.47 libraries on 2026-10-08 (probes/eg2demo/ROUND3.md) and is not a row here.",
  "quantization": "publisher's card: transformer and embeddings int4 per-channel (QAT), vision encoder int8 per-channel (QAT), audio encoder mixed int2/int4/int8 per-channel (QAT)",
  "results": [
    {
      "accelerator": "gpu",
      "context_length": null,
      "date": "2026-10-09",
      "decode_tokens_per_s": null,
      "delegated_ops": null,
      "env": {
        "device": "Galaxy S26 (SM-S942Q)",
        "machine_label": "galaxy-s26-eg2search-check",
        "os_build": "Android 16 (build BP4A.251205.006.S942QOPS1AZH9)",
        "runtime": "litert-lm",
        "runtime_version": "0.18.0",
        "soc": "Qualcomm SM8850",
        "vendor_sdk": null
      },
      "error": null,
      "evidence": [
        "harness: hfmodels-android samples/eg2search (main 4fb5364; the sample is commit 6e37478), androidTest Eg2DeviceCheck, com.google.ai.edge.litertlm:litertlm-android 0.18.0 named in the sample's own build file",
        "10-09 23:44:15.734 I/hfmodels-check(30876): RESULT step=load ok=true bundle=/storage/emulated/0/Android/data/io.github.johnrocky.hfmodels.samples.eg2search/files/embeddinggemma-2-740m.litertlm bytes=484622336 sha256_12=e7a8a2204b91 backends=\"audio encoder on CPU · backbone and photos on GPU\" init_ms=5417.0 warmup_ms=94.6 load_ms=5512",
        "10-09 23:44:24.806 I/hfmodels-check(30876): RESULT step=index ok=true photos=36 files=36 embedded=36 reused=0 failed=0 total_ms=9071.7 per_image_ms_median=252.5 per_image_ms_min=230.8 per_image_ms_max=265.0 cache_error=null",
        "10-09 23:44:25.590 I/hfmodels-check(30876): RESULT step=query_q01_a ok=true clip=q01_a.wav gold=a01 top1=a01 top1_cos=0.7204 top3=a01:0.7204,a35:0.5949,a34:0.5872 embed_ms=173.5 rank_ms=4.29 seconds=2.58 rms=0.06433 album=37",
        "10-09 23:44:25.748 I/hfmodels-check(30876): RESULT step=query_q08_a ok=true clip=q08_a.wav gold=a10 top1=a10 top1_cos=0.6412 top3=a10:0.6412,a11:0.6139,a20:0.5773 embed_ms=150.2 rank_ms=4.63 seconds=1.97 rms=0.05568 album=37",
        "10-09 23:44:25.936 I/hfmodels-check(30876): RESULT step=query_q13_a ok=true clip=q13_a.wav gold=a20 top1=a20 top1_cos=0.7127 top3=a20:0.7127,a21:0.6440,a03:0.5876 embed_ms=172.4 rank_ms=14.13 seconds=2.11 rms=0.06015 album=37",
        "10-09 23:44:30.504 I/hfmodels-check(30876): RESULT ok=true steps=13 failed=[] failure_paths_ok=6 failure_paths=[import_none,no_match,release,reload,missing_bundle,permission] model=litert-community/embeddinggemma-2-740m-litert-lm bundle=embeddinggemma-2-740m.litertlm backends=\"audio encoder on CPU · backbone and photos on GPU\" runtime=litertlm-android 0.18.0 device=SM-S942Q soc=SM8850 build=BP4A.251205.006.S942QOPS1AZH9 thermal=0->1",
        "10-09 23:44:13.741 I/tflite  (30876): Replacing 1011 out of 1011 node(s) with delegate (LITERT_CL) node, yielding 1 partitions for subgraph 1 (encoder_1x128).",
        "10-09 23:44:11.751 I/tflite  (30876): Replacing 1477 out of 1477 node(s) with delegate (LITERT_CL) node, yielding 1 partitions for subgraph 1 (vision_70).",
        "10-09 23:44:12.153 I/tflite  (30876): Replacing 1436 out of 1600 node(s) with delegate (TfLiteXNNPackDelegate) node, yielding 226 partitions for subgraph 0 (main)."
      ],
      "failure_class": null,
      "full_delegation": true,
      "latency_p50_ms": 172.4,
      "loads": true,
      "max_abs_diff": null,
      "max_rel_diff": null,
      "metrics": {
        "close_ms": 195.0,
        "failure_paths_ok": 6.0,
        "import_ms": 26.3,
        "index_total_ms": 9071.7,
        "init_ms_no_cache": 5417.0,
        "load_ms": 5512.0,
        "photo_embed_ms_max": 265.0,
        "photo_embed_ms_median": 252.5,
        "photo_embed_ms_min": 230.8,
        "photos": 36.0,
        "queries": 3.0,
        "queries_top1_equal_gold": 3.0,
        "query_embed_ms_max": 173.5,
        "query_embed_ms_min": 150.2,
        "reload_init_ms": 2350.0,
        "reload_query_embed_ms": 285.8,
        "reload_warmup_ms": 212.2,
        "rerun_init_ms": 1845.9,
        "rerun_photo_embed_ms_median": 267.3,
        "rerun_query_embed_ms_median": 239.5,
        "stop_ms": 310.0,
        "warmup_ms": 94.6
      },
      "output_match": null,
      "peak_mem_mb": null,
      "prefill_tokens_per_s": null,
      "provenance": "measured",
      "runs": true,
      "signature": "EmbeddingEngine backend GPU, visionBackend GPU, audioBackend CPU; hfmodels-android samples/eg2search Eg2DeviceCheck, one spoken query per call",
      "total_ops": null,
      "ttft_ms": null
    }
  ],
  "schema_version": "1.0"
}
