{
  "artifact": "SmolLM2_135M_Instruct.litertlm",
  "device": "galaxy-s26",
  "model_id": "smollm2-135m-instruct",
  "quantization": null,
  "results": [
    {
      "accelerator": "gpu",
      "context_length": null,
      "date": "2026-08-24",
      "decode_tokens_per_s": 52.49,
      "delegated_ops": 1393,
      "env": {
        "device": "Galaxy S26 (SM-S942Q)",
        "machine_label": "galaxy-s26-cl-pinned",
        "os_build": "Android 16",
        "runtime": "litert-lm",
        "runtime_version": "0.16.0",
        "soc": "Qualcomm SM8850",
        "vendor_sdk": null
      },
      "error": null,
      "evidence": [
        "VERBOSE: Replacing 1274 out of 1274 node(s) with delegate (LITERT_CL) node, yielding 1 partitions for subgraph 0 (decode).",
        "VERBOSE: Replacing 1393 out of 1393 node(s) with delegate (LITERT_CL) node, yielding 1 partitions for subgraph 1 (prefill_256).",
        "results block: prefill=1691.75 decode=52.49 tokens/s"
      ],
      "failure_class": null,
      "full_delegation": true,
      "latency_p50_ms": null,
      "loads": true,
      "max_abs_diff": null,
      "max_rel_diff": null,
      "metrics": {
        "decode_tokens": 3891.0,
        "init_s": 0.93447,
        "prefill_tokens": 205.0
      },
      "output_match": null,
      "peak_mem_mb": null,
      "prefill_tokens_per_s": 1691.75,
      "provenance": "measured",
      "runs": true,
      "total_ops": 1393,
      "ttft_ms": 140.0
    }
  ],
  "schema_version": "1.0"
}
