{
  "artifact": "bitcpm-cann-1b_wi4b32_wi8.litertlm",
  "device": "mac-studio-m4-max",
  "model_id": "bitcpm-cann-1b-int4",
  "quantization": null,
  "results": [
    {
      "accelerator": "gpu",
      "context_length": null,
      "date": "2026-08-12",
      "decode_tokens_per_s": 188.85,
      "delegated_ops": null,
      "env": {
        "device": "Mac Studio (M4 Max)",
        "machine_label": "mac-studio-m4-max",
        "os_build": null,
        "runtime": "litert-lm",
        "runtime_version": "0.16.0",
        "soc": "Apple M4 Max",
        "vendor_sdk": null
      },
      "error": null,
      "evidence": [
        "results block: prefill=2946.29 decode=188.85 tokens/s, init=1.4622 s"
      ],
      "failure_class": null,
      "full_delegation": null,
      "latency_p50_ms": null,
      "loads": true,
      "max_abs_diff": null,
      "max_rel_diff": null,
      "metrics": {
        "decode_tokens": 256.0,
        "init_s": 1.4622,
        "max_num_tokens": 1024.0,
        "prefill_tokens": 256.0
      },
      "output_match": null,
      "peak_mem_mb": null,
      "prefill_tokens_per_s": 2946.29,
      "provenance": "measured",
      "runs": true,
      "total_ops": null,
      "ttft_ms": 92.2
    }
  ],
  "schema_version": "1.0"
}
