{
  "artifact": "dis.tflite",
  "device": "raspberry-pi-5",
  "model_id": "dis-isnet",
  "quantization": null,
  "results": [
    {
      "accelerator": "cpu_xnnpack",
      "context_length": null,
      "date": "2026-08-31",
      "decode_tokens_per_s": null,
      "delegated_ops": null,
      "env": {
        "device": "Raspberry Pi 5 Model B Rev 1.1",
        "machine_label": "raspberry-pi-5",
        "os_build": "Linux-6.18.34+rpt-rpi-2712-aarch64-with-glibc2.41",
        "runtime": "litert",
        "runtime_version": "2.2.0.dev20260804",
        "soc": null,
        "vendor_sdk": null
      },
      "error": null,
      "evidence": [
        "pi5 sweep row: LiteRT benchmark_model, CPU/XNNPACK at --num_threads=4, 3 invocations per file of 10 warm-up + 50 timed runs (the tool caps a phase at 150 s, so very slow graphs run fewer); latency = median of the three per-invocation medians over the timed phase; a row counts as measured only when every invocation exited 0 with XNNPACK engaged and vcgencmd get_throttled 0x0 before and after",
        "versions: ai-edge-litert-nightly=2.2.0.dev20260804, benchmark_model_sha256=babc9275addd8612caf0842294cb5b3f301c3cce46e6c5979cd2803f215f6bee, cpu=Raspberry Pi 5 Model B Rev 1.1, litert-cli-nightly=0.2.0.dev20260805, platform=Linux-6.18.34+rpt-rpi-2712-aarch64-with-glibc2.41, python=3.13.5",
        "invocation 0: exit=0 wall_s=178.1 temp 49.4->69.7C throttled=0x0 xnnpack=True median_us=2963283.0 runs=50 footprint_peak_mb=941.05",
        "invocation 1: exit=0 wall_s=178.6 temp 51.6->72.5C throttled=0x0 xnnpack=True median_us=2954601.0 runs=50 footprint_peak_mb=940.55",
        "invocation 2: exit=0 wall_s=178.6 temp 51.0->69.7C throttled=0x0 xnnpack=True median_us=2956654.0 runs=50 footprint_peak_mb=939.55"
      ],
      "failure_class": null,
      "full_delegation": null,
      "latency_p50_ms": 2956.654,
      "loads": true,
      "max_abs_diff": null,
      "max_rel_diff": null,
      "metrics": {
        "init_ms": 396.273,
        "invocations": 3,
        "iterations": 150,
        "latency_max_ms": 3155.763,
        "latency_min_ms": 2909.85,
        "threads": 4,
        "warmup_runs_per_invocation": 10
      },
      "output_match": null,
      "peak_mem_mb": 941.05,
      "prefill_tokens_per_s": null,
      "provenance": "measured",
      "runs": true,
      "total_ops": null,
      "ttft_ms": null
    }
  ],
  "schema_version": "1.0"
}
