{
  "artifact": "granite-4.0-micro_int4.litertlm",
  "artifact_sha256": "b931889ac060fb563f5ae20b3f4ebc772297f15f77cdb9b0f55b1b25a160b325",
  "device": "galaxy-s26",
  "model_id": "granite-4.0-micro-int4",
  "notes": "Hub litert-community/granite-4.0-micro (re-ship commit 894dc755, 2026-10-16 13:50 JST; main 3314ac2e; the files of the first upload 5fd7b966 were replaced; the Hub tree's LFS sha256 = tools/sha256_r6d.txt of the lane's cand/*_rf files). Lane litertlm-convert aa_mobile_work/granite40_micro (s26/hold_1 = hold 2026-10-15 17:09:29-17:27:05 JST; s26/hold_2 = hold 2026-10-15 20:14:34-20:32:36 JST; SPEED_LADDER.md row 43 (GPU), lint PASS) = the own-phone measurement the Hub card cites beside its lab table ('within 3 % of these numbers'); the record's cells are the median of the two holds (both orders against the other forms), each hold's values in metrics (run1_* / run2_*), the #223 two-run shape. The file pushed is cand/granite-4.0-micro_int4_rf.litertlm (device-side sha256 = Mac = the Hub file). Legs through device/llm_leg.sh (run_legs_r9.sh s26 <splitA|splitB|splitC> <hold number> - aa6e (r6e) device round r9 = a copy of device/run_legs_r8.sh (same…): compiled-program and weight caches removed, a warm-up process (cold init), the benchmark process (1024-token prefill, 256 decode, max_num_tokens 2048, 3 iterations; per-leg cells = the mean of iterations 2-3 = the leg JSON's median_2_3, peak = the runtime's 'Peak system ram usage' line), one prompt process ('What is the capital of France? Answer in one sentence.'); the harness's sampler beside each process (2 s: CPU caps, kgsl/Mali, MemAvailable, VmRSS/VmHWM; guard at MemAvailable < 400 MB; no GUARD_KILL line in any sampler of these legs). Thermal status at the benchmark starts: i4_rf_gpu_A 2, i4_rf_gpu_B 2; benchmark sampler lines (metrics capped_samples = the harness's flag for the leg's own backend: CPU policy caps on a CPU leg, the kgsl ceiling on a GPU leg): i4_rf_gpu_A: CPU clock capped in 26 of 28, kgsl GPU ceiling lowered in 23 of 28 (lowest 826 MHz); i4_rf_gpu_B: CPU clock capped in 28 of 29, kgsl GPU ceiling lowered in 25 of 29 (lowest 646 MHz). Device, SoC and build: each hold's device_id.txt. Not entered: the Hub card's Galaxy S26 table itself - one session per row on Google's Developer Device Platform (lab unit m1q-36, SPEED_LADDER.md rows 47-51): lab-unit rows are lane evidence only (#224 (5)(b)); so the int8 GPU row and both CPU rows of this phone have no record; the retrofit variants timed beside the published file in the same holds (rows 44 int4_rf_nr, 45 int4_rf_sb; never shipped, #174(3)) and the 2026-10-13 file's same-hold control (row 46); the 2026-10-13 files' earlier rounds (rows 1-34: bytes the re-ship replaced on the Hub).",
  "quantization": "int4 blockwise-32 + OCTAV on linears, int8 embedding; the embedding table in its own section; GPU-composite graph",
  "results": [
    {
      "accelerator": "gpu",
      "context_length": null,
      "date": "2026-10-15",
      "decode_tokens_per_s": 20.2425,
      "delegated_ops": 1821,
      "env": {
        "device": "Galaxy S26 (SM-S942Q)",
        "machine_label": "galaxy-s26-aab1",
        "os_build": "Android 16 (BP4A.251205.006)",
        "runtime": "litert-lm",
        "runtime_version": "prebuilt-adac974b",
        "soc": "Qualcomm SM8850",
        "vendor_sdk": null
      },
      "error": null,
      "evidence": [
        "binary: Google's prebuilt litert_lm_advanced_main + 6 .so (gs://litert/binaries/latest/android_arm64/litert_lm/, object dated 2026-09-18, 40,382,152 B, sha256 adac974b…; kit = litertlm-convert team_repack_20261009/r9/binary/prebuilt)",
        "run 1 r9/hold_1 hold 2026-10-15 17:09:29-17:27:05 JST: [17:16:56] bundle on device: b931889ac060fb563f5ae20b3f4ebc772297f15f77cdb9b0f55b1b25a160b325 (2198475104 B, push 0 s) = Mac",
        "[17:19:47] parsed: i4_rf_gpu_A gpu: gate PASS 1/1 | bench prefill 239.65 decode 20.64 init 8433.48 cold 11747.75 peak 1474.07 capped 23/28 | answers: 'The capital of France is Paris.'",
        "run 1 prompt process (device/r9/s26/i4_rf_gpu_A/gpu_leg.json): \"The capital of France is Paris.\"",
        "run 2 r9/hold_2 hold 2026-10-15 20:14:34-20:32:36 JST: [20:24:22] bundle on device: b931889ac060fb563f5ae20b3f4ebc772297f15f77cdb9b0f55b1b25a160b325 (2198475104 B, push 0 s) = Mac",
        "[20:27:44] parsed: i4_rf_gpu_B gpu: gate PASS 1/1 | bench prefill 231.515 decode 19.845 init 8552.92 cold 11543.6 peak 1401.45 capped 25/29 | answers: 'The capital of France is Paris.'",
        "run 2 prompt process (device/r9/s26/i4_rf_gpu_B/gpu_leg.json): \"The capital of France is Paris.\"",
        "bench args: --backend=gpu --model_path=/data/local/tmp/aa6_g40micro/granite-4.0-micro_int4_rf.litertlm --benchmark=true --benchmark_prefill_tokens=1024 --benchmark_decode_tokens=256 --max_num_tokens=2048 --num_iterations=3 --report_peak_memory_footprint=true --metric_proto_file_path=/data/local/tmp/aa6_g40micro/metrics.pb",
        "VERBOSE: Replacing 1821 out of 1821 node(s) with delegate (LITERT_CL) node, yielding 1 partitions for subgraph 0 (prefill_1024).",
        "VERBOSE: Replacing 1821 out of 1821 node(s) with delegate (LITERT_CL) node, yielding 1 partitions for subgraph 1 (prefill_256).",
        "VERBOSE: Replacing 1821 out of 1821 node(s) with delegate (LITERT_CL) node, yielding 1 partitions for subgraph 2 (prefill_64).",
        "VERBOSE: Replacing 1821 out of 1821 node(s) with delegate (LITERT_CL) node, yielding 1 partitions for subgraph 3 (prefill_16).",
        "VERBOSE: Replacing 1821 out of 1821 node(s) with delegate (LITERT_CL) node, yielding 1 partitions for subgraph 4 (prefill_4).",
        "VERBOSE: Replacing 1622 out of 1622 node(s) with delegate (LITERT_CL) node, yielding 1 partitions for subgraph 5 (prefill_1).",
        "VERBOSE: Replacing 1653 out of 1653 node(s) with delegate (LITERT_CL) node, yielding 1 partitions for subgraph 6 (decode)."
      ],
      "failure_class": null,
      "full_delegation": true,
      "latency_p50_ms": null,
      "loads": true,
      "max_abs_diff": null,
      "max_rel_diff": null,
      "metrics": {
        "cold_init_ms": 11645.675,
        "decode_tokens": 256.0,
        "init_ms": 8493.2,
        "iterations": 3.0,
        "max_num_tokens": 2048.0,
        "prefill_tokens": 1024.0,
        "run1_boot_epoch_s": 1791938976.61,
        "run1_capped_samples": 23.0,
        "run1_cold_init_ms": 11747.75,
        "run1_cpu_capped_samples": 26.0,
        "run1_decode_tok_s": 20.64,
        "run1_init_ms": 8433.48,
        "run1_kgsl_ceiling_min_mhz": 826.0,
        "run1_peak_mem_mb": 1474.07,
        "run1_prefill_tok_s": 239.65,
        "run1_sampler_samples": 28.0,
        "run1_thermal_status_at_bench_start": 2.0,
        "run1_ttft_s": 4.335,
        "run2_boot_epoch_s": 1791938976.61,
        "run2_capped_samples": 25.0,
        "run2_cold_init_ms": 11543.6,
        "run2_cpu_capped_samples": 28.0,
        "run2_decode_tok_s": 19.845,
        "run2_init_ms": 8552.92,
        "run2_kgsl_ceiling_min_mhz": 646.0,
        "run2_peak_mem_mb": 1401.45,
        "run2_prefill_tok_s": 231.515,
        "run2_sampler_samples": 29.0,
        "run2_thermal_status_at_bench_start": 2.0,
        "run2_ttft_s": 4.475,
        "runs": 2.0,
        "t_1024_256_s": 16.9933
      },
      "output_match": null,
      "peak_mem_mb": 1437.76,
      "prefill_tokens_per_s": 235.5825,
      "provenance": "measured",
      "runs": true,
      "total_ops": 1821,
      "ttft_ms": 4405.0
    }
  ],
  "schema_version": "1.0"
}
