{
  "artifact": "Nemotron-3-Nano-4B_int8.litertlm",
  "device": "mac-studio-m4-max",
  "model_id": "nemotron-3-nano-4b-int8",
  "quantization": "dynamic int8 (linears + embedding; convolutions and the selective scan stay float), fp32 activations declared, reduced 7-signature prefill ladder",
  "results": [
    {
      "accelerator": "cpu",
      "context_length": null,
      "date": "2026-08-27",
      "decode_tokens_per_s": 22.73,
      "delegated_ops": null,
      "env": {
        "device": "mac-studio-m4-max",
        "machine_label": "m4max-loaded-internvl-export",
        "os_build": null,
        "runtime": "litert-lm",
        "runtime_version": "0.16.0",
        "soc": "Apple M4 Max",
        "vendor_sdk": null
      },
      "error": null,
      "evidence": [
        "results block: prefill=99.57 decode=22.73 tokens/s"
      ],
      "failure_class": null,
      "full_delegation": null,
      "latency_p50_ms": null,
      "loads": true,
      "max_abs_diff": null,
      "max_rel_diff": null,
      "metrics": {
        "decode_tokens": 256.0,
        "prefill_tokens": 256.0
      },
      "output_match": null,
      "peak_mem_mb": null,
      "prefill_tokens_per_s": 99.57,
      "provenance": "measured",
      "runs": true,
      "total_ops": null,
      "ttft_ms": 2643.2
    },
    {
      "accelerator": "gpu",
      "context_length": null,
      "date": "2026-08-27",
      "decode_tokens_per_s": 83.3,
      "delegated_ops": null,
      "env": {
        "device": "mac-studio-m4-max",
        "machine_label": "m4max-loaded-internvl-export",
        "os_build": null,
        "runtime": "litert-lm",
        "runtime_version": "0.16.0",
        "soc": "Apple M4 Max",
        "vendor_sdk": null
      },
      "error": null,
      "evidence": [
        "results block: prefill=803.37 decode=83.3 tokens/s"
      ],
      "failure_class": null,
      "full_delegation": null,
      "latency_p50_ms": null,
      "loads": true,
      "max_abs_diff": null,
      "max_rel_diff": null,
      "metrics": {
        "decode_tokens": 256.0,
        "prefill_tokens": 256.0
      },
      "output_match": null,
      "peak_mem_mb": null,
      "prefill_tokens_per_s": 803.37,
      "provenance": "measured",
      "runs": true,
      "total_ops": null,
      "ttft_ms": 330.7
    }
  ],
  "schema_version": "1.0"
}
