{
  "artifact": "granite-4.2-3b_int4.litertlm",
  "artifact_sha256": "2abaaca65ecd4cf13cd0acd594cec53d48cae1ef975e30bfa898a7d2f6e7dbc0",
  "device": "mac-studio-m4-max",
  "model_id": "granite-4.2-3b-int4",
  "quantization": "int4",
  "results": [
    {
      "accelerator": "cpu",
      "context_length": null,
      "date": "2026-08-31",
      "decode_tokens_per_s": 21.47,
      "delegated_ops": null,
      "env": {
        "device": "Mac Studio (M4 Max)",
        "machine_label": "mac-studio-m4-max",
        "os_build": null,
        "runtime": "litert-lm",
        "runtime_version": "0.16.0",
        "soc": null,
        "vendor_sdk": null
      },
      "error": null,
      "evidence": [
        "results block: prefill=106.37 decode=21.47 tokens/s"
      ],
      "failure_class": null,
      "full_delegation": null,
      "latency_p50_ms": null,
      "loads": true,
      "max_abs_diff": null,
      "max_rel_diff": null,
      "metrics": {
        "decode_tokens": 256.0,
        "prefill_tokens": 256.0
      },
      "output_match": null,
      "peak_mem_mb": null,
      "prefill_tokens_per_s": 106.37,
      "provenance": "measured",
      "runs": true,
      "total_ops": null,
      "ttft_ms": 2944.0
    },
    {
      "accelerator": "gpu",
      "context_length": null,
      "date": "2026-08-31",
      "decode_tokens_per_s": 85.46,
      "delegated_ops": null,
      "env": {
        "device": "Mac Studio (M4 Max)",
        "machine_label": "m4max-quiet-300s-gpu-rest",
        "os_build": null,
        "runtime": "litert-lm",
        "runtime_version": "0.16.0",
        "soc": null,
        "vendor_sdk": null
      },
      "error": null,
      "evidence": [
        "results block: prefill=1239.98 decode=85.46 tokens/s"
      ],
      "failure_class": null,
      "full_delegation": null,
      "latency_p50_ms": null,
      "loads": true,
      "max_abs_diff": null,
      "max_rel_diff": null,
      "metrics": {
        "decode_tokens": 256.0,
        "prefill_tokens": 256.0
      },
      "output_match": null,
      "peak_mem_mb": null,
      "prefill_tokens_per_s": 1239.98,
      "provenance": "measured",
      "runs": true,
      "total_ops": null,
      "ttft_ms": 236.7
    }
  ],
  "schema_version": "1.0"
}
